SOURCE,EXTERNAL_ID,PMCID,DOI,AUTHORS,PUBLICATION_YEAR,PUBLICATION_MONTH,TITLE,JOURNAL,VOLUME,ISSUE,PAGE_INFO,TIMES_CITED,GRANTS,OPEN_ACCESS,LICENSE,FIRST_PUB_DATE (dd/mm/yyyy),EMBARGO_DATE (dd/mm/yyyy),IN_EPMC,EPMC_AUTH_MAN
MED,32289516,PMC7194109,10.1016/j.jtho.2020.04.003,"Cai, Yixin; Hao, Zhipeng; Gao, Yi; Ping, Wei; Wang, Qi; Peng, Shu; Zhao, Bo; Sun, Wei; Zhu, Min; Li, Kaiyan; Han, Ying; Kuang, Dong; Chu, Qian; Fu, Xiangning; Zhang, Ni",2020,4,"Coronavirus Disease 2019 in the Perioperative Period of Lung Resection: A Brief Report From a Single Thoracic Surgery Department in Wuhan, People's Republic of China.","J Thorac Oncol",,"","",0,"",Y,,2020-04-11,,Y,N
PMC,PMC7163482,PMC7163482,10.1002/eji.202070035,"Park, Mirae; Thwaites, Ryan S.; Openshaw, Peter J. M.",2020,3,COVID‐19: Lessons from SARS and MERS.,"Eur J Immunol",50,"3","308-311",0,"",Y,,2020-02-27,,Y,N
MED,32219428,PMC7101507,10.1001/jama.2020.4783,"Shen, Chenguang; Wang, Zhaoqin; Zhao, Fang; Yang, Yang; Li, Jinxiu; Yuan, Jing; Wang, Fuxiang; Li, Delin; Yang, Minghui; Xing, Li; Wei, Jinli; Xiao, Haixia; Yang, Yan; Qu, Jiuxin; Qing, Ling; Chen, Li; Xu, Zhixiang; Peng, Ling; Li, Yanjie; Zheng, Haixia; Chen, Feng; Huang, Kun; Jiang, Yujing; Liu, Dongjing; Zhang, Zheng; Liu, Yingxia; Liu, Lei",2020,3,Treatment of 5 Critically Ill Patients With COVID-19 With Convalescent Plasma.,"JAMA",,"","",0,"",N,,2020-03-27,2020-09-27,Y,N
MED,32347204,PMC7189648,10.2807/1560-7917.ES.2020.25.16.2000421,"Perera, Ranawaka Apm; Mok, Chris Kp; Tsang, Owen Ty; Lv, Huibin; Ko, Ronald Lw; Wu, Nicholas C; Yuan, Meng; Leung, Wai Shing; Chan, Jacky Mc; Chik, Thomas Sh; Choi, Chris Yc; Leung, Kathy; Chan, Kin Ho; Chan, Karl Ck; Li, Ka-Chi; Wu, Joseph T; Wilson, Ian A; Monto, Arnold S; Poon, Leo Lm; Peiris, Malik",2020,4,"Serological assays for severe acute respiratory syndrome coronavirus 2 (SARS-CoV-2), March 2020.","Euro Surveill",25,"16","",0,"""NIAID NIH HHS"":""K99 AI139445""",Y,cc by,2020-04-01,,Y,N
MED,32289115,PMC7128473,10.1016/j.jhepr.2020.100113,"Boettler, Tobias; Newsome, Philip N; Mondelli, Mario U; Maticic, Mojca; Cordero, Elisa; Cornberg, Markus; Berg, Thomas",2020,6,Care of patients with liver disease during the COVID-19 pandemic: EASL-ESCMID position paper.,"JHEP Rep",2,"3","100113",0,"",Y,cc by-nc-nd,2020-04-02,,Y,N
MED,32297828,,10.1089/vim.2020.0062,"Liu, Yang; Liao, Wenjian; Wan, Lagen; Xiang, Tianxing; Zhang, Wei",2020,4,Correlation Between Relative Nasopharyngeal Virus RNA Load and Lymphocyte Count Disease Severity in Patients with COVID-19.,"Viral Immunol",,"","",0,"",N,,2020-04-10,,N,N
